{
  "id": "onus-update-positive",
  "class": "discovery",
  "prompt": "Update the existing work item with this progress.",
  "fixture": "discovery/catalog",
  "invariants": [
    {
      "type": "selected_skill",
      "description": "The host selects onus:update.",
      "value": "onus:update"
    }
  ],
  "forbidden": [
    "selects an unrelated skill"
  ],
  "target_skill": "onus:update",
  "expectation": "positive",
  "control": {
    "ablate_description": true
  }
}
