{
  "id": "mantra-troubleshoot-positive",
  "class": "discovery",
  "prompt": "Systematically diagnose this failing test and find its root cause.",
  "fixture": "discovery/catalog",
  "invariants": [
    {
      "type": "selected_skill",
      "description": "The host selects mantra:troubleshoot.",
      "value": "mantra:troubleshoot"
    }
  ],
  "forbidden": [
    "selects an unrelated skill"
  ],
  "target_skill": "mantra:troubleshoot",
  "expectation": "positive",
  "control": {
    "ablate_description": true
  }
}
