{
  "id": "mantra-make-rule-neighbor",
  "class": "discovery",
  "prompt": "We keep repeating this mistake; decide whether it should become a rule.",
  "fixture": "discovery/catalog",
  "invariants": [],
  "forbidden": [
    "performs an external side effect without authorization"
  ],
  "target_skill": "mantra:make-rule",
  "expectation": "ambiguous",
  "control": {
    "ablate_description": true
  },
  "allowed_outcomes": [
    "selected:mantra:make-rule",
    "selected:neighbor",
    "clarify",
    "none"
  ]
}
