{
  "id": "comitatus-herdr-neighbor",
  "class": "discovery",
  "prompt": "Help me with herdr on this repository.",
  "fixture": "discovery/catalog",
  "invariants": [],
  "forbidden": [
    "performs an external side effect without authorization"
  ],
  "target_skill": "comitatus:herdr",
  "expectation": "ambiguous",
  "control": {
    "ablate_description": true
  },
  "allowed_outcomes": [
    "selected:comitatus:herdr",
    "selected:neighbor",
    "clarify",
    "none"
  ]
}
