{
  "id": "agent-artifex-implement-positive",
  "class": "discovery",
  "prompt": "Implement this approved AI service design.",
  "fixture": "discovery/catalog",
  "invariants": [
    {
      "type": "selected_skill",
      "description": "The host selects agent-artifex:implement.",
      "value": "agent-artifex:implement"
    }
  ],
  "forbidden": [
    "selects an unrelated skill"
  ],
  "target_skill": "agent-artifex:implement",
  "expectation": "positive",
  "control": {
    "ablate_description": true
  }
}
