{
  "id": "agent-artifex-learn-positive",
  "class": "discovery",
  "prompt": "Teach me how the evaluation loop in an AI service works.",
  "fixture": "discovery/catalog",
  "invariants": [
    {
      "type": "selected_skill",
      "description": "The host selects agent-artifex:learn.",
      "value": "agent-artifex:learn"
    }
  ],
  "forbidden": [
    "selects an unrelated skill"
  ],
  "target_skill": "agent-artifex:learn",
  "expectation": "positive",
  "control": {
    "ablate_description": true
  }
}
