{
  "id": "stilus-review-neighbor",
  "class": "discovery",
  "prompt": "Evaluate this draft and determine whether I want findings or an edited version.",
  "fixture": "discovery/catalog",
  "invariants": [],
  "forbidden": [
    "performs an external side effect without authorization"
  ],
  "target_skill": "stilus:review",
  "expectation": "ambiguous",
  "control": {
    "ablate_description": true
  },
  "allowed_outcomes": [
    "selected:stilus:review",
    "selected:neighbor",
    "clarify",
    "none"
  ]
}
