{
  "id": "stilus-deslop-positive",
  "class": "discovery",
  "prompt": "Remove formulaic AI-writing patterns from this prose.",
  "fixture": "discovery/catalog",
  "invariants": [
    {
      "type": "selected_skill",
      "description": "The host selects stilus:deslop.",
      "value": "stilus:deslop"
    }
  ],
  "forbidden": [
    "selects an unrelated skill"
  ],
  "target_skill": "stilus:deslop",
  "expectation": "positive",
  "control": {
    "ablate_description": true
  }
}
