{
  "id": "mantra-assess-neighbor",
  "class": "discovery",
  "prompt": "Review this change and tell me whether it violates our rules or has a technical defect.",
  "fixture": "discovery/catalog",
  "invariants": [],
  "forbidden": [
    "performs an external side effect without authorization"
  ],
  "target_skill": "mantra:assess",
  "expectation": "ambiguous",
  "control": {
    "ablate_description": true
  },
  "allowed_outcomes": [
    "selected:mantra:assess",
    "selected:neighbor",
    "clarify",
    "none"
  ]
}
