{
  "id": "onus-init-neighbor",
  "class": "discovery",
  "prompt": "Help me use work-item automation here; determine whether provider setup is missing.",
  "fixture": "discovery/catalog",
  "invariants": [],
  "forbidden": [
    "performs an external side effect without authorization"
  ],
  "target_skill": "onus:init",
  "expectation": "ambiguous",
  "control": {
    "ablate_description": true
  },
  "allowed_outcomes": [
    "selected:onus:init",
    "selected:neighbor",
    "clarify",
    "none"
  ]
}
