{
  "id": "agent-artifex-guide-neighbor",
  "class": "discovery",
  "prompt": "Help me with this AI service project; first determine which lifecycle phase I am in.",
  "fixture": "discovery/catalog",
  "invariants": [],
  "forbidden": [
    "performs an external side effect without authorization"
  ],
  "target_skill": "agent-artifex:guide",
  "expectation": "ambiguous",
  "control": {
    "ablate_description": true
  },
  "allowed_outcomes": [
    "selected:agent-artifex:guide",
    "selected:neighbor",
    "clarify",
    "none"
  ]
}
