{
  "id": "onus-validate-criteria-positive",
  "class": "discovery",
  "prompt": "Validate the implementation against the work item's acceptance criteria.",
  "fixture": "discovery/catalog",
  "invariants": [
    {
      "type": "selected_skill",
      "description": "The host selects onus:validate-criteria.",
      "value": "onus:validate-criteria"
    }
  ],
  "forbidden": [
    "selects an unrelated skill"
  ],
  "target_skill": "onus:validate-criteria",
  "expectation": "positive",
  "control": {
    "ablate_description": true
  }
}
