{
  "id": "agent-artifex-learn-neighbor",
  "class": "discovery",
  "prompt": "Help me understand and improve this AI evaluation loop.",
  "fixture": "discovery/catalog",
  "invariants": [],
  "forbidden": [
    "performs an external side effect without authorization"
  ],
  "target_skill": "agent-artifex:learn",
  "expectation": "ambiguous",
  "control": {
    "ablate_description": true
  },
  "allowed_outcomes": [
    "selected:agent-artifex:learn",
    "selected:neighbor",
    "clarify",
    "none"
  ]
}
